{
  "schema": 1,
  "version": "2026.07.01",
  "updated": "2026-07-01T00:00:00Z",
  "repo": "Shon1a/Stredio-official-addons",
  "section": "official",
  "addons": [
    {
      "id": "upcoming",
      "section": "official",
      "name": "Upcoming Movies & Series scrolling addon",
      "version": "1.3.0",
      "ver": "v1.3.0",
      "iconCls": "puzzle",
      "glyph": "✦",
      "tags": ["catalog", "metadata"],
      "defaultInstalled": true,
      "noConfig": true,
      "preview": true,
      "kind": "discovery",
      "types": ["movie", "series"],
      "resources": ["catalog", "meta"],
      "flags": { "official": true, "protected": true }
    },
    {
      "id": "studios",
      "section": "official",
      "name": "Studios row addon",
      "version": "1.0.0",
      "ver": "v1.0.0",
      "iconCls": "puzzle",
      "glyph": "▷",
      "tags": ["catalog", "metadata"],
      "defaultInstalled": true,
      "noConfig": true,
      "preview": true,
      "kind": "discovery",
      "types": ["movie", "series"],
      "resources": ["catalog"],
      "flags": { "official": true, "protected": true }
    },
    {
      "id": "catalog",
      "section": "official",
      "name": "Trending & Top Rated rows addon",
      "version": "1.0.0",
      "ver": "v1.0.0",
      "iconCls": "puzzle",
      "glyph": "▤",
      "tags": ["catalog", "metadata"],
      "defaultInstalled": true,
      "kind": "discovery",
      "types": ["movie", "series"],
      "resources": ["catalog"],
      "flags": { "official": true, "protected": true }
    },
    {
      "id": "providers",
      "section": "official",
      "name": "Streaming Services rows addon",
      "version": "1.0.0",
      "ver": "v1.0.0",
      "iconCls": "puzzle",
      "glyph": "▭",
      "tags": ["catalog", "metadata"],
      "defaultInstalled": false,
      "kind": "discovery",
      "types": ["movie", "series"],
      "resources": ["catalog"],
      "flags": { "official": true, "protected": true }
    }
  ]
}
